Entity Registration Date,Entity Profile UEN,Entity Name,Primary Section Description,Description,Website,Industry
2020-01-01,202000015R,JULIAN GREY PTE. LTD.,FINANCIAL AND INSURANCE ACTIVITIES,"TRUSTS, FUNDS AND SIMILAR FINANCIAL ENTITIES (EG COLLECTIVE PORTFOLIO INVESTMENT FUNDS (EXCLUDING THOSE WITH RENTAL INCOME))","https://www.julian-grey.com","TRUSTS, FUNDS AND SIMILAR FINANCIAL ENTITIES (EG COLLECTIVE PORTFOLIO INVESTMENT FUNDS (EXCLUDING THOSE WITH RENTAL INCOME))"
2020-01-01,202000015R,JULIAN GREY VENTURES PTE. LTD.,FINANCIAL AND INSURANCE ACTIVITIES,"TRUSTS, FUNDS AND SIMILAR FINANCIAL ENTITIES (EG COLLECTIVE PORTFOLIO INVESTMENT FUNDS (EXCLUDING THOSE WITH RENTAL INCOME))","https://www.julian-grey.com","TRUSTS, FUNDS AND SIMILAR FINANCIAL ENTITIES (EG COLLECTIVE PORTFOLIO INVESTMENT FUNDS (EXCLUDING THOSE WITH RENTAL INCOME))"
2020-01-01,202000017W,PRECIOUS (GLOBAL) PTE. LTD.,FINANCIAL AND INSURANCE ACTIVITIES,"OTHER HOLDING COMPANIES","","OTHER HOLDING COMPANIES"
2020-01-01,202000018H,ALLIED STAR PTE. LTD.,FINANCIAL AND INSURANCE ACTIVITIES,"INSURANCE AGENCIES AND AGENTS (INCLUDING FINANCIAL PLANNING SERVICES)","","INSURANCE AGENCIES AND AGENTS (INCLUDING FINANCIAL PLANNING SERVICES)"
2020-01-01,202000024W,LAUNCH I/O PTE. LTD.,FINANCIAL AND INSURANCE ACTIVITIES,"VENTURE CAPITAL ACTIVITIES","","VENTURE CAPITAL ACTIVITIES"
2020-01-01,202000051D,EMINENT MANAGEMENT CONSULTANTS PTE. LTD.,FINANCIAL AND INSURANCE ACTIVITIES,"OTHER HOLDING COMPANIES","","OTHER HOLDING COMPANIES"
2020-01-01,202000061R,SEMITECH HOLDINGS PTE. LTD.,FINANCIAL AND INSURANCE ACTIVITIES,"INVEST SEMICONDUTOR AND MICROELECTRONIC R&D","","OTHER HOLDING COMPANIES"
2020-01-01,202000083D,DAISYFIELDS HOLDINGS PTE. LTD.,FINANCIAL AND INSURANCE ACTIVITIES,"INVESTMENT HOLDING","","OTHER HOLDING COMPANIES"
2020-04-24,202000088W,8X CAPITAL PTE. LTD.,FINANCIAL AND INSURANCE ACTIVITIES,"HEDGE FUND MANAGEMENT","","HEDGE FUND MANAGEMENT"
